{
  "$schema": "https://aikido-game.internal/schemas/v1/scenario.json",
  "schemaVersion": "1.0",
  "id": "scen_angry_pm_deadline_001",
  "contentVersion": 1,
  "title": {
    "hu": "A bedőlt sprint és a dühös projektmenedzser",
    "en": "The Failed Sprint and the Angry Project Manager",
    "de": "Der gescheiterte Sprint und die wütende Projektmanagerin"
  },
  "summary": {
    "hu": "A projektmenedzser a csapat előtt téged hibáztat a csúszásért. Őrizd meg a hidegvéred, és tereld a beszélgetést a közös megoldás felé.",
    "en": "The project manager blames you for the delay in front of the team. Keep your cool and steer the conversation towards a solution.",
    "de": "Die Projektmanagerin gibt dir vor dem Team die Schuld an der Verzögerung. Bleib ruhig und lenke das Gespräch in Richtung Lösung."
  },
  "briefing": {
    "hu": "Sprint review, csütörtök délután. A modulod két napot csúszott, mivel a specifikáció is késve érkezett. {npc_name} a csapat előtt fordul feléd, és láthatóan a {trigger_word} miatti nyomás beszél belőle.",
    "en": "Sprint review, Thursday afternoon. Your module is two days late because the specification also arrived late. {npc_name} turns to you in front of the team, and it is clearly the pressure of the {trigger_word} talking.",
    "de": "Sprint-Review, Donnerstagnachmittag. Dein Modul ist zwei Tage zu spät, weil auch die Spezifikation verspätet kam. {npc_name} wendet sich vor dem ganzen Team an dich, und man merkt: Hier spricht der Druck der {trigger_word}."
  },
  "difficulty": "INTERMEDIATE",
  "personas": ["P1_MANAGER"],
  "npc": {
    "name": {
      "hu": "Dóra",
      "en": "Dóra",
      "de": "Dóra"
    },
    "role": {
      "hu": "projektmenedzser",
      "en": "project manager",
      "de": "Projektmanagerin"
    }
  },
  "variables": {
    "trigger_word": {
      "hu": "határidő",
      "en": "deadline",
      "de": "Deadline"
    }
  },
  "initialState": {
    "escalation": 65,
    "grounding": 100,
    "confusion": 0
  },
  "startNodeId": "step_01",
  "nodes": [
    {
      "nodeId": "step_01",
      "tone": "ANGRY",
      "npcStatement": {
        "hu": "Már megint képtelen voltál időben leadni a modult! Mindent nekem kell megoldanom helyetted?!",
        "en": "You failed to deliver the module on time again! Do I have to fix everything for you?!",
        "de": "Schon wieder hast du das Modul nicht rechtzeitig geliefert! Muss ich denn alles für dich erledigen?!"
      },
      "availableCards": [
        {
          "cardId": "c_pace_01",
          "category": "PACING",
          "text": {
            "hu": "Látom rajtad, hogy rettenetesen feszült vagy a csúszás és a {trigger_word} miatt.",
            "en": "I can see you're really stressed about the delay and the {trigger_word}.",
            "de": "Ich sehe, dass dich die Verzögerung und die {trigger_word} total unter Druck setzen."
          },
          "delta": {
            "escalation": -20,
            "grounding": 8,
            "confusion": 10
          },
          "npcReaction": {
            "hu": "Hát persze hogy feszült vagyok, a megrendelő már tűkön ül miatta!",
            "en": "Of course I'm stressed, the whole client is waiting for this!",
            "de": "Natürlich stehe ich unter Druck, der ganze Kunde wartet darauf!"
          },
          "nextNodeId": "step_02_calmed",
          "debriefHint": {
            "hu": "Az érzelem kimondása egyetértés nélkül csökkenti a nyomást.",
            "en": "Naming the emotion without agreeing takes pressure out of the situation.",
            "de": "Das Gefühl zu benennen, ohne zuzustimmen, nimmt Druck aus der Situation."
          }
        },
        {
          "cardId": "c_metamodel_01",
          "category": "META_MODEL",
          "text": {
            "hu": "Mit értesz pontosan az alatt, hogy „mindent neked kell megoldanod”?",
            "en": "What exactly do you mean by 'I have to fix everything'?",
            "de": "Was genau meinst du mit 'ich muss alles erledigen'?"
          },
          "delta": {
            "escalation": -5,
            "grounding": -2,
            "confusion": 30
          },
          "npcReaction": {
            "hu": "Hát... konkrétan ezt a két API-integrációt ma délután.",
            "en": "Well... specifically these two API integrations this afternoon.",
            "de": "Na ja... konkret diese zwei API-Integrationen heute Nachmittag."
          },
          "nextNodeId": "step_02_focused",
          "debriefHint": {
            "hu": "Az általánosítás („mindent”) megkérdezése konkrétumra szűkíti a vitát.",
            "en": "Questioning the generalization (\"everything\") narrows the argument down to specifics.",
            "de": "Die Verallgemeinerung („alles“) zu hinterfragen, bringt den Streit auf Konkretes."
          }
        },
        {
          "cardId": "c_reframe_01",
          "category": "REFRAMING",
          "text": {
            "hu": "Mindketten azt akarjuk, hogy az ügyfél péntekre működő rendszert kapjon. Nézzük meg, mi kell ehhez.",
            "en": "We both want the client to have a working system by Friday. Let's look at what that takes.",
            "de": "Wir wollen beide, dass der Kunde bis Freitag ein funktionierendes System hat. Schauen wir, was es dafür braucht."
          },
          "delta": {
            "escalation": -15,
            "grounding": 12,
            "confusion": 18
          },
          "npcReaction": {
            "hu": "Jó... de akkor most tényleg nézzük meg, mert fogy az időnk.",
            "en": "Okay... but then let's really look at it, we have no time.",
            "de": "Okay... aber dann schauen wir uns das jetzt wirklich an, wir haben keine Zeit."
          },
          "nextNodeId": "step_02_calmed",
          "debriefHint": {
            "hu": "A közös cél behozása áthelyezi a fókuszt a hibáztatásról a megoldásra.",
            "en": "Bringing in the shared goal moves the focus from blame to solution.",
            "de": "Das gemeinsame Ziel verschiebt den Fokus von der Schuld zur Lösung."
          }
        },
        {
          "cardId": "c_defense_01",
          "category": "DEFENSE",
          "text": {
            "hu": "Nem az én hibám: te adtad át a specifikációt két nap késéssel!",
            "en": "It's not my fault, you handed over the specification two days late!",
            "de": "Das ist nicht meine Schuld, du hast die Spezifikation zwei Tage zu spät übergeben!"
          },
          "delta": {
            "escalation": 30,
            "grounding": -20,
            "confusion": -10
          },
          "npcReaction": {
            "hu": "Még te vádaskodsz?! Az én időmet pazarlod!",
            "en": "Now you're accusing me?! You're wasting my time!",
            "de": "Jetzt beschuldigst du auch noch mich?! Du verschwendest meine Zeit!"
          },
          "nextNodeId": "step_02_escalated",
          "debriefHint": {
            "hu": "Igaz lehet, de most magyarázkodásnak hangzik, és a partner védekezni kezd.",
            "en": "It may be true, but right now it sounds like an excuse and puts your partner on the defensive.",
            "de": "Es mag stimmen, aber jetzt klingt es nach Rechtfertigung, und dein Gegenüber geht in die Verteidigung."
          }
        },
        {
          "cardId": "c_attack_01",
          "category": "ATTACK",
          "text": {
            "hu": "Ha rendesen szerveznéd a projektet, nem tartanánk itt.",
            "en": "If you organized the project properly, we wouldn't be here.",
            "de": "Wenn du das Projekt ordentlich organisieren würdest, wären wir nicht hier."
          },
          "delta": {
            "escalation": 38,
            "grounding": -28,
            "confusion": -22
          },
          "npcReaction": {
            "hu": "Ezt most komolyan a csapat előtt mondod?!",
            "en": "Are you seriously saying that in front of the team?!",
            "de": "Sagst du das gerade ernsthaft vor dem ganzen Team?!"
          },
          "nextNodeId": "step_02_escalated",
          "debriefHint": {
            "hu": "A visszatámadás személyes síkra viszi a konfliktust, és mindkét felet kimeríti.",
            "en": "Hitting back makes the conflict personal and drains both sides.",
            "de": "Zurückschlagen macht den Konflikt persönlich und erschöpft beide Seiten."
          }
        }
      ]
    },
    {
      "nodeId": "step_02_calmed",
      "tone": "TENSE",
      "npcStatement": {
        "hu": "Az ügyfél reggel már kétszer hívott. Nem tudom, mit mondjak neki.",
        "en": "The client has already called twice this morning. I don't know what to tell them.",
        "de": "Der Kunde hat heute Morgen schon zweimal angerufen. Ich weiß nicht, was ich ihm sagen soll."
      },
      "availableCards": [
        {
          "cardId": "c_pace_02",
          "category": "PACING",
          "text": {
            "hu": "Megértem: rémes úgy felvenni a telefont, hogy még nincs jó híred.",
            "en": "I get it, it's awful to pick up the phone when you have no good news.",
            "de": "Verstehe, es ist unangenehm, ans Telefon zu gehen, wenn man keine guten Nachrichten hat."
          },
          "delta": {
            "escalation": -18,
            "grounding": 6,
            "confusion": 8
          },
          "npcReaction": {
            "hu": "Pontosan. Mindig nekem kell tartanom a hátam.",
            "en": "Exactly. I always take the heat.",
            "de": "Genau. Ich muss immer den Kopf hinhalten."
          },
          "nextNodeId": "step_03_plan",
          "debriefHint": {
            "hu": "A helyzet nehézségének elismerése bizalmat épít.",
            "en": "Acknowledging how hard the situation is builds trust.",
            "de": "Anzuerkennen, wie schwierig die Lage ist, schafft Vertrauen."
          }
        },
        {
          "cardId": "c_metamodel_02",
          "category": "META_MODEL",
          "text": {